Nama,Alamat,Telepon,Tags
Prodia Panakkukang,"Jl. Boulevard Ruko Ruby I No. 7-8, Panakkukang Mas, Makassar 90222",0411-446666,"AXA Mandiri Financial Services, Corporate Solution, Individu Solution"
Prodia Pangkal Pinang,"Jl. KH. Abdurrahman Siddiq No.176 Pangkal Pinang, Bangka Belitung",0717-438232,"AXA Mandiri Financial Services, Corporate Solution, Individu Solution"
Prodia Pantai Indah Kapuk,Rukan Gold Coast B2-B3 Pantai Indah Kapuk Jakarta Utara 14470,021-29032788-99,"AXA Mandiri Financial Services, Corporate Solution, Individu Solution"
Prodia Pare-Pare,"Jl. Andi Mappatola No. 7, Pare-pare 91114",0421-22265/7007433,"AXA Mandiri Financial Services, Corporate Solution, Individu Solution"
Prodia Pasar Minggu,"Jl.Raya Pasar Minggu No.98 E, Jakarta Selatan 12510",021-7986247/7901922/79184723,"AXA Mandiri Financial Services, Corporate Solution, Individu Solution"
Prodia Pasirkaliki,"Jl. Pasirkaliki No. 225, Bandung 40162",022-2034685,"AXA Mandiri Financial Services, Corporate Solution, Individu Solution"
Prodia Pekanbaru,"Jl. Cempaka No. 80 B-C, Pekanbaru, Riau 28156",0761-45542/45543,"AXA Mandiri Financial Services, Corporate Solution, Individu Solution"
Prodia Pekanbaru (PHC),Jl. Jendral Sudirman No.203 L-M Pekanbaru Riau,0761-8403383/856739,"AXA Mandiri Financial Services, Corporate Solution, Individu Solution"
Prodia Pematang Siantar,Jl. Merdeka No.37 Pematang Siantar 21118,0622-22437,"AXA Mandiri Financial Services, Corporate Solution, Individu Solution"
Prodia Pluit,"Komp.Ruko Sentra Bisnis Pluit,Jl.Pluit Sakti Raya No.28A Blok A-6 Jakarta Utara 14440",021-66603561/66600571,"AXA Mandiri Financial Services, Corporate Solution, Individu Solution"
Prodia Pontianak,Jl.Ahmad Yani No.6C Pontianak,0561-736177,"AXA Mandiri Financial Services, Corporate Solution, Individu Solution"
Prodia Purbalingga,Jl. Letjend Suprapto No.17B Purbalingga,0281-7605997,"AXA Mandiri Financial Services, Corporate Solution, Individu Solution"
Prodia Puri Indah,"Komplek Sentra Niaga Puri indah Blok T6/28,Jl/Puri Lingkar Dalam Jakarta Barat 11610",021-58304501/58304570,"AXA Mandiri Financial Services, Corporate Solution, Individu Solution"
Prodia Purwakarta,Jl.Veteran No.96 Purwakarta,0264-8222633,"AXA Mandiri Financial Services, Corporate Solution, Individu Solution"
Prodia Purwokerto,"Jl.Letjen S.Parman No.946A, Purwokerto 53141",0281-631558/642448,"AXA Mandiri Financial Services, Corporate Solution, Individu Solution"
Prodia Purworejo,"JL. Achmad Yani No.22 B, Purworejo 54118",0275-323985,"AXA Mandiri Financial Services, Corporate Solution, Individu Solution"
Prodia Rantau Prapat,Jl. Ahmad Yani No.197 Rantau Prapat 21415,0624-25368,"AXA Mandiri Financial Services, Corporate Solution, Individu Solution"
Prodia Raya Darmo Permai,"Jl. Raya Darmo Permai Selatan 1F, Surabaya 60226",031-7328866/7343066/7322020,"AXA Mandiri Financial Services, Corporate Solution, Individu Solution"
Prodia Salatiga,"Jl. Brigjend. Sudiarto No. 18 A, Salatiga 50721",0298-311371,"AXA Mandiri Financial Services, Corporate Solution, Individu Solution"
Prodia Samarinda,"Jl. A. Yani Komp. Cendrawasih Trade Center Blok A-6, Samarinda",0541-736198,"AXA Mandiri Financial Services, Corporate Solution, Individu Solution"
Prodia Sampit,"Jl. Di Pandjaitan No 15 C, Sampit Kotawaringin Timur – Kalimantan Tengah",0531-2614849,"AXA Mandiri Financial Services, Corporate Solution, Individu Solution"
Prodia Semarang (Jend.Sudirman),Jl. Jend Sudirman No.121 Semarang 50142,024-7621757,"AXA Mandiri Financial Services, Corporate Solution, Individu Solution"
Prodia Semarang (MT Haryono),"Jl. M.T Haryono No.882, Semarang 50242",024-8444331,"AXA Mandiri Financial Services, Corporate Solution, Individu Solution"
Prodia Semarang (Setiabudi),Ruko Setiabudi No.8 Jl.Setiabudi 119D Semarang 50263,024-7479369,"AXA Mandiri Financial Services, Corporate Solution, Individu Solution"
Prodia Senior Health Centre (PSHC),Jl. Metro Pondok Indah TB-32 Kebayoran Lama Jakarta Selatan,021-7662545,"AXA Mandiri Financial Services, Corporate Solution, Individu Solution"
Prodia Serang,Jl. Kh. Sochari No.4 Sumur Pecung Serang – Banten,0254-7919569,"AXA Mandiri Financial Services, Corporate Solution, Individu Solution"
Prodia Sibolga,"Jl.S. Parman No.77, Sibolga 22523",0631-22539,"AXA Mandiri Financial Services, Corporate Solution, Individu Solution"
Prodia Sidoarjo,Jl. Pahlawan 12A Sidoarjo,031-8961010,"AXA Mandiri Financial Services, Corporate Solution, Individu Solution"
Prodia Singaraja,"Jl. Ngurah Rai No. 67 Blok D, Singaraja, Bali 81113",0362-24516,"AXA Mandiri Financial Services, Corporate Solution, Individu Solution"
Prodia Solo,Jl.Ronggowarsito No.143 Solo 57131,0271-646378,"AXA Mandiri Financial Services, Corporate Solution, Individu Solution"
Prodia Sorong,"Ruko Vini Vidi No.7-8 Klaigi Distrik Sorong Manoi,Sorong Papua Barat",0951-3178505,"AXA Mandiri Financial Services, Corporate Solution, Individu Solution"
Prodia Sragen,"Jl. Kolonel Sugiyono No.8,Widoro,Sragen",0271-890263,"AXA Mandiri Financial Services, Corporate Solution, Individu Solution"
Prodia Sukabumi,"Jl. Jend. Sudirman No. 42 B, Banteng, Warudoyong, Sukabumi, Jawa Barat",0226-6226400,"AXA Mandiri Financial Services, Corporate Solution, Individu Solution"
Prodia Sumedang,"Jl.P Geusanulun No.111, Sumedang 45312",0261-201259,"AXA Mandiri Financial Services, Corporate Solution, Individu Solution"
Prodia Summarecon Bekasi,"Rukan Sinpasa Blok A 20 Jl. Boulevard Selatan Summarecon Bekasi, Bekasi Utara 17415",021-8840480,"AXA Mandiri Financial Services, Corporate Solution, Individu Solution"
Prodia Sunter,Jl. Danau Sunter Utara Blok C1 No.14 Sunter Agung Jakarta Utara 14350,021-65308116/65308117,"AXA Mandiri Financial Services, Corporate Solution, Individu Solution"
Prodia Sunter Griya,"Jl. Griya Utama Blok A. No.22 Sunter Agung, Tanjung Priok, Jakarta Utara",021-65835034,"AXA Mandiri Financial Services, Corporate Solution, Individu Solution"
Prodia Surabaya Diponegoro,"Jl. Diponegoro No. 149-151, Surabaya",031-28953900,"AXA Mandiri Financial Services, Corporate Solution, Individu Solution"
Prodia Surabaya Mega Galaxi,"Ruko Mega Galaxi, Jl Kertajaya Indah Timur 14C No.6 Surabaya 60282",031-5991010,"AXA Mandiri Financial Services, Corporate Solution, Individu Solution"
Prodia Surabaya Wiyung,Jl. Raya Menganti Ruko Taman Pondok Indah A-35 Surabaya Jawa Timur,031-99750099,"AXA Mandiri Financial Services, Corporate Solution, Individu Solution"
Prodia Tabanan,"Jl. Ngurah Rai No.43 Apotek Mawar Farma, Kediri Tabanan 82121",0361-812758,"AXA Mandiri Financial Services, Corporate Solution, Individu Solution"
Prodia Taman Palem,"Jl. Taman Palem Blok G2 No.16 Rt 008 Rw 015 Cengkareng Barat, Cengkareng – Jakarta Barat",021-22554769,"AXA Mandiri Financial Services, Corporate Solution, Individu Solution"
Prodia Tangerang,"Sutera Niaga I No.21 Ruko Alam Sutera Serpong, Tangerang 15325",021-5399961/53122587,"AXA Mandiri Financial Services, Corporate Solution, Individu Solution"
Prodia Tangerang Kota,"Jl. Jendral Sudirman Tangerang City Premium Business Park Blok A No.11 Babakan, Tangerang",021-59731610,"AXA Mandiri Financial Services, Corporate Solution, Individu Solution"
Prodia Tanjung Pinang,"Jl. Ir. Sutami, Ruko Villa Akasia No. 20",0771-25305,"AXA Mandiri Financial Services, Corporate Solution, Individu Solution"
Prodia Tarakan,"Jl. Yos Sudarso No. 8, Tarakan, Kalimantan Utara",085345837007,"AXA Mandiri Financial Services, Corporate Solution, Individu Solution"
Prodia Tasik,Jl. R.E. Martadinata No.9 Tasikmalaya,0265-2353080,"AXA Mandiri Financial Services, Corporate Solution, Individu Solution"
Prodia Tebing Tinggi,"Jl. Sudirman No.257 D, Tebing Tinggi 26014",0621-22494,"AXA Mandiri Financial Services, Corporate Solution, Individu Solution"
Prodia Tegal,Jl.Kapten Sudibyo No.136 Tegal 52114,0283-358673/353664,"AXA Mandiri Financial Services, Corporate Solution, Individu Solution"
Prodia Temanggung,Ruko Pandean Jl. Mt Haryono Temanggung - Jawa Tengah,0293-4960160,"AXA Mandiri Financial Services, Corporate Solution, Individu Solution"
Prodia Ternate,"Jl. Mononutu No.21, Ternate, Maluku Utara 97713",0921-3111246,"AXA Mandiri Financial Services, Corporate Solution, Individu Solution"
Prodia Tulung Agung,Jl. Supriadi No.45 Blok A.14 Ruko Nirwana,0355-336989,"AXA Mandiri Financial Services, Corporate Solution, Individu Solution"
Prodia Wastu Kencana,Jl. Wastukencana No.38 Bandung 40116,022-4231362/4239538/4264059,"AXA Mandiri Financial Services, Corporate Solution, Individu Solution"
Prodia Women's Health Centre (PWHC),Jl. Wolter Monginsidi No.77 Kebayoran Baru Jakarta Selatan,021-72783858,"AXA Mandiri Financial Services, Corporate Solution, Individu Solution"
Prodia Wonogiri,"Jl. Jend. Achmad Yani No. 58, Wonogiri 57612",0273-321447,"AXA Mandiri Financial Services, Corporate Solution, Individu Solution"
Prodia Wonosobo,"Jl. Kauman No. 15, Wonosobo 56311 (Pertigaan Mangli)",0286-325275,"AXA Mandiri Financial Services, Corporate Solution, Individu Solution"
Prodia Yogyakarta Bintaran,Jl.Bintaran Kulon No.28 Yogyakarta 55151,0274-373271/375273,"AXA Mandiri Financial Services, Corporate Solution, Individu Solution"
Prodia Yogyakarta Mangkubumi,Jl.Pangeran Mangkubumi No.50 Yogyakarta 55232,0274-515818,"AXA Mandiri Financial Services, Corporate Solution, Individu Solution"
PROF. DR. I.G.N.G NGOERAH,"Jl. Diponegoro, Desa/Kelurahan Dauh Puri, Kec. Denpasar Barat, Kota Denpasar, Bali - 80114",0361 227911-15,"AXA Mandiri Financial Services, Corporate Solution, Individu Solution"
Prof. Dr. R.D Kandou Manado,"Jl. Raya Tanawangko No.56 Manado, Sulawesi Utara",0431-838203,"AXA Mandiri Financial Services, Corporate Solution, Individu Solution"
Prof.Dr.Boloni,Jl. W.Monginsidi No.11 Medan,061-4512687 / 4556879,"AXA Mandiri Financial Services, Corporate Solution, Individu Solution"
Provinsi NTB,"Jl. Praburangkasari Dasan Cermen, Mataram NTB",0370-7502424,"AXA Mandiri Financial Services, Corporate Solution, Individu Solution"
Provita,"Jl.Sam Ratulangi No.39 Apo Rt.05 Rw.02 Kel.Bhayangkara Kec. Jayapura Utara, Papua",0967-5162888,"AXA Mandiri Financial Services, Corporate Solution, Individu Solution"
Pupuk Kaltim,Jl. Oksigen No.1 Komp.Pupuk Kaltim,0548-41118 / 41444,"AXA Mandiri Financial Services, Individu Solution"
Pupuk Kaltim (Pupuk Kaltim Group),Jl. Oksigen No.1 Komp.Pupuk Kaltim,0548-41118 / 41444,"AXA Mandiri Financial Services, Corporate Solution, Individu Solution"
Puri Asih,Jl. Jend. Sudirman No.169 Salatiga,0298-323209,"AXA Mandiri Financial Services, Corporate Solution, Individu Solution"
Puri Asih Cikampek,Jl. Stasiun No.2 Cikampek Kota,0264-303558 / 0264-361459,"AXA Mandiri Financial Services, Corporate Solution, Individu Solution"
Puri Asih Jatisari,Jl. Raya Jatisari No.3 Pasar Jatisari,0264-361459/361466,"AXA Mandiri Financial Services, Corporate Solution, Individu Solution"
Puri Asih Kosambi,"Jl. Kosambi - Telagasari No.108 Kp.Pundong Rt.02/ Rw.03 Blendung Klari, Karawang Jawa Barat",0267-7301451,"AXA Mandiri Financial Services, Corporate Solution, Individu Solution"
Puri Asih Telukjambe,"Dusun Sukamulya, Desa Pinayungan, Teluk Jambe",0267-646845,"AXA Mandiri Financial Services, Corporate Solution, Individu Solution"
Puri Betik Hati,Jl. Pajajaran No.109 Jagabaya II Bandar Lampung,0721-787799,"AXA Mandiri Financial Services, Corporate Solution, Individu Solution"
Puri Bunda,"Jl. Gatot Subroto Vi, No.19",0361-437999,"AXA Mandiri Financial Services, Corporate Solution, Individu Solution"
Puri Bunda Tabanan,"Jl. Dr Ir Soekarno, Banjar Anyar, Kec. Kediri, Tabanan - Bali",0361-2095888,"AXA Mandiri Financial Services, Corporate Solution, Individu Solution"
Puri Cinere,"JL. Maribaya No.1 Puri Cinere, Depok - Jawa Barat",021-7545488,"AXA Mandiri Financial Services, Corporate Solution, Individu Solution"
Puri Garcia,"Jl. Griya Purnama, No.2, Nangka",0254-223333,"AXA Mandiri Financial Services, Corporate Solution, Individu Solution"
Puri Husada,"Jl. Budi Utomo Ujung, Timika Papua",0901-3126661,"AXA Mandiri Financial Services, Corporate Solution, Individu Solution"
Puri Indah,"Jl. Puri Indah Raya Blok S2, Kembangan Selatan",021-25695222/25695200,"AXA Mandiri Financial Services, Corporate Solution, Individu Solution"
Puri Malang,"Jl. Taman Slamet No.20 Gading Kasri Kec.Klojen Malang, Jawa Timur",0341-325329,"AXA Mandiri Financial Services, Corporate Solution, Individu Solution"
Puri Medika,"Jl.  Sungai Bambu Raya, No.5, Tanjung Priok",021-43903355/43931975,"AXA Mandiri Financial Services, Corporate Solution, Individu Solution"
Puri Raharja,Jl. Wr Supratman No.14-19 Denpasar Bali,0361-222013,"AXA Mandiri Financial Services, Corporate Solution, Individu Solution"
Pusat Otak Nasional,"Jl. M.T Haryono Kav 11 Cawang, Jakarta Timur",021-29373377,"AXA Mandiri Financial Services, Corporate Solution, Individu Solution"
Pusat Persahabatan,Jl. Persahabatan Raya No.1 Rawamangun Jakarta Timur,021-4891708,"AXA Mandiri Financial Services, Corporate Solution"
Pusat Pertamina,Jl. Kyai Maja No. 43 Jakarta Selatan,021-7219000,"AXA Mandiri Financial Services, Corporate Solution, Individu Solution"
Puspa Husada,"JL. Raya Pondok Timur KM.1 No.27 Jatimulya Tambun Selatan, Bekasi",021-82618978/82618979,"AXA Mandiri Financial Services, Corporate Solution, Individu Solution"
Pusri,"Jl.  Mayor Zen, Komplek Pusri No. 1 Palembang Sumatera Selatan",0711 -712222/712111,"AXA Mandiri Financial Services, Corporate Solution, Individu Solution"
Pusura Tegalsari (Medis Pusura 4),JL. Tegal Sari No.59,031-5473462,"AXA Mandiri Financial Services, Corporate Solution, Individu Solution"
Putera Bahagia (Siloam Group),"Jl. Ciremai Raya No.114 ,Perumnas",0231-207351/4990900,"AXA Mandiri Financial Services, Corporate Solution, Individu Solution"
Putewa,Jl. Nusa Indah Raya Blok 40 No.17 H Jakarta Timur,021-8622207,"AXA Mandiri Financial Services, Corporate Solution, Individu Solution"
Putra Dalima,"Griya Loka, Sektor 1.2, Blok Ua/26-27, Bumi Serpong Damai",021-5380375/5388279,"AXA Mandiri Financial Services, Corporate Solution, Individu Solution"
Putra Medika,Jl. Perum Vila Mutiara Kampung Kukun Cikarang No.115 RT.012/06 Ds. Ciantra. Cikarang Selatan,021-298888506,"AXA Mandiri Financial Services, Corporate Solution, Individu Solution"
Putra Medika ( Group Aqma Pusat ),Jl. Ir. H. Juanda No.14-19 Sukaseuri,0264-301652,"AXA Mandiri Financial Services, Individu Solution"
Putra Medika (Group Aqma Pusat),Jl. Ir. H. Juanda No.14-19 Sukaseuri,0264-301652,"AXA Mandiri Financial Services, Corporate Solution, Individu Solution"
Putra Medika 2,Jl. Raya Cikarang Cibarusah KM.28 RT.012/006 Ds. Ciantra Kec. Cikarang Selatan,021-8971612,"AXA Mandiri Financial Services, Corporate Solution, Individu Solution"
Putra Medika 3,"Jl. Perum Kota Serang Baru, Kp. Gebang Ds.Sukaragam Kec.Serang Baru, Cikarang Bekasi",0733-324963 / 324955,"AXA Mandiri Financial Services, Corporate Solution, Individu Solution"
Putra Medika 4,"Jl. Raya Sukamahi, Tembong Gunung, Sukamahi Cikarang Pusat, Bekasi",021-22158727 / 087779305000,"AXA Mandiri Financial Services, Corporate Solution, Individu Solution"
Putra Medika Cibenda,"Jl. Pasar Cibenda Desa Sirnajaya, Serang Baru, Bekasi Jawa Barat",021-89677215,"AXA Mandiri Financial Services, Corporate Solution, Individu Solution"
Putri,"JL. Arif Rahman Hakim, No.122 Surabaya",031-5999987,"AXA Mandiri Financial Services, Corporate Solution, Individu Solution"
Qirani,"Jl. Delima 1A No.15A Rt 002 Rw 004 Kel. Malaka Sari, Duren Sawit Jakarta Timur",0291-95000,"AXA Mandiri Financial Services, Corporate Solution, Individu Solution"
Quantum Sarana Medik,Jl. Raya Sesetan No. 20,0361-228835,"AXA Mandiri Financial Services, Corporate Solution, Individu Solution"
Queen Latifa Kulon Progo,"Jl. Raya Jogja Wates Km.21 Sukoreno, Sentolo, Kulon Progo D.I Yogyakarta",0274-2890679,"AXA Mandiri Financial Services, Corporate Solution, Individu Solution"
Rafflesia,"Jl. Mahoni, No. 10, Padang Jati",0736-21710,"AXA Mandiri Financial Services, Corporate Solution, Individu Solution"
Rajawali,Jl. Rajawali No.38 Bandung,022-6011913/6031087/6079143,"AXA Mandiri Financial Services, Corporate Solution, Individu Solution"
Ratulangi Medical Centre,"Jl. Sam Ratulangi No.28 Makassar, Sulawesi Selatan",0411-878688 / 878605-06,"AXA Mandiri Financial Services, Corporate Solution, Individu Solution"
Rawa Lumbu,"Jl. Dasa Darma, No.20-23, Rawa Lumbu",021-82422511,"AXA Mandiri Financial Services, Corporate Solution, Individu Solution"
Rawamangun,"Jl. Balai Pustaka Raya, No.29-31",021-4893531,"AXA Mandiri Financial Services, Corporate Solution, Individu Solution"
Rawamangun (Group of Pertamina Jaya),Jl. Mundu Raya No. 1 Jakarta Timur,021-4894150/ 48942378,"AXA Mandiri Financial Services, Corporate Solution, Individu Solution"
Rawat Inap Central Medika,"Jl. Pilar - Sukatani, Ds Sukaraya No 84, Karang Bahagia",021-89111103,"AXA Mandiri Financial Services, Corporate Solution, Individu Solution"
Rays International Dental Clinic,Jl.Brawijaya VIII No.2 Jakarta Selatan,021-7262347,"AXA Mandiri Financial Services, Corporate Solution, Individu Solution"
Recons Fit Indonesia,"Jl. Balayudha No.970 Kec. Kemuning, Palembang 30128",08117301707,"AXA Mandiri Financial Services, Corporate Solution, Individu Solution"
Reksa Waluya,"Jl. Mojopahit, No.422",0321-322170/322171,"AXA Mandiri Financial Services, Corporate Solution, Individu Solution"
Rennicha Putra,Jl. Raya Cikarang Cibarusah No 89 Lippo Cikarang,021-8971852/8971658,"AXA Mandiri Financial Services, Corporate Solution, Individu Solution"
Resti Mulya,Jl. Pahlawan Komarudin Raya No. 5 Penggilingan Cakung,021-4802192/4803707/4803936,"AXA Mandiri Financial Services, Corporate Solution, Individu Solution"
Restu Ibu,JL. Jend A.Yani No.12 Balikpapan,0542-427342/3/4,"AXA Mandiri Financial Services, Corporate Solution, Individu Solution"
Restu Ibu Dukuh,"Jl. Penggilingan Baru No.3 Dukuh, Kramat Jati, Jakarta Timur",021-87786723,"AXA Mandiri Financial Services, Corporate Solution, Individu Solution"
Restu Ibu Pejaten,"Jl. Swadaya 1 No.54 A-B Pejaten Timur, Pasar Minggu, Jakarta Selatan",021-78840267,"AXA Mandiri Financial Services, Corporate Solution, Individu Solution"
Restu Kasih,JL. Raya Bogor Km.19 No.3A Kramat Jati- Jakarta Timur 13510,021-8001177/8002166,"AXA Mandiri Financial Services, Corporate Solution, Individu Solution"
Ridhoka Salma,Jl. Imam Bonjol No.7 Gardu Sawah,021-89116527,"AXA Mandiri Financial Services, Corporate Solution, Individu Solution"
Risa Sentra Medika,"Jl. Pejanggik No.115 Cakranegara, Mataram",0370-632117/625560,"AXA Mandiri Financial Services, Corporate Solution, Individu Solution"
RK.Charitas Palembang,JL. Jend. Sudirman No.1054,0711-350426/353375,"AXA Mandiri Financial Services, Corporate Solution, Individu Solution"
Roemani Muhammadiyah,"Jl. Wondri, No.22",024-8444623,"AXA Mandiri Financial Services, Corporate Solution, Individu Solution"
Rosela,"JL. Interchange tol Karawang Barat no.3 ds. Wadas, kec. Karawang Timur",0267-8637207/8637205,"AXA Mandiri Financial Services, Corporate Solution, Individu Solution"
Rosiva,"Jl. Bangka No.15, Gg. Buntu, Kec. Medan Timur, Medan Sumatera Utara",061-4510522,"AXA Mandiri Financial Services, Corporate Solution, Individu Solution"
Royal Health Care,Jl. Buncit Raya No. 99 Kalibata Pancoran Jakarta Selatan,021-7940015 / 0811935249,"AXA Mandiri Financial Services, Corporate Solution, Individu Solution"
Royal Prima,"Jl. Raden Wijaya Rt.35 Kebun Kopi, Kel Thehok, Jambi Selatan",0741-41010,"AXA Mandiri Financial Services, Corporate Solution, Individu Solution"
Royal Prima Marelan,"Jl. Marelan Raya Pasar Iii No.187 Kel.Rengas Pulau Kec.Medan Marelan, Medan",061-42731858,"AXA Mandiri Financial Services, Corporate Solution, Individu Solution"
Royal Prima Medan,Jl. Ayahanda No. 68 A Medan Sumatera Utara,061-88813182,"AXA Mandiri Financial Services, Corporate Solution, Individu Solution"
Royal Progress Int Hospital,"Jl. Danau Sunter Utara, Sunter Paradise I",021-6400261,"AXA Mandiri Financial Services, Corporate Solution, Individu Solution"
Royal Surabaya,Jl.Rungkut Industri I No.1 Surabaya,031-8476111,"AXA Mandiri Financial Services, Corporate Solution, Individu Solution"
Royal Taruma,Jl. Daan Mogot No.34 Grogol,021-56958338/56967788,"AXA Mandiri Financial Services, Corporate Solution, Individu Solution"
RS. Pertamina Rantau,"Jl. Cepu No.1 Komperta Field Rantau Aceh Tamiang, Nanggroe Aceh Darussalam",0641-31165,"AXA Mandiri Financial Services, Individu Solution"
Rs. St. Elisabeth Medan,Jl. H. Misbah No.7 Medan Sumatera Utara,061-4144737,"AXA Mandiri Financial Services, Corporate Solution, Individu Solution"
Rsop Ciamis,"Jl. Ciamis - Banjar No.341, Cijeungjing, Kec. Cijeungjing Ciamis Jawa Barat",0265 - 7600450,"AXA Mandiri Financial Services, Corporate Solution, Individu Solution"
RSPKT 1 Imam Bonjol (Pupuk Kaltim Group),Jl.Imam Bonjol Bontang,0548-24800,"AXA Mandiri Financial Services, Corporate Solution, Individu Solution"
RSPKT 2 Bengalon (Pupuk Kaltim Group),"Jl. Poros Bengalon - Sangkulirang Sepaso Timur Bengalon, Kutai Timur, Bali",081330492294,"AXA Mandiri Financial Services, Corporate Solution, Individu Solution"
RSU Mulia Hati Wonogiri,"Jl. RM Said No. 08, Brumbung, Kaliancar, Kec. Selogiri",0273-5329700,"AXA Mandiri Financial Services, Corporate Solution, Individu Solution"
RSUPN Cipto Mangunkusumo (KENCANA),Jl. Diponegoro no.71,"021-1500 135 , 021-9200 5164","AXA Mandiri Financial Services, Corporate Solution, Individu Solution"
RSUPN Cipto Mangunkusumo Pusat (NON KENCANA),Jl. Diponegoro no.71,021-3148991 / 3914661,"AXA Mandiri Financial Services, Corporate Solution, Individu Solution"
Rumah Indonesia Sehat Hospital,Jl. Lengkon Gudang Timur Raya No. 777 Bsd City Tangerang Banten,021- 29660950,"AXA Mandiri Financial Services, Corporate Solution, Individu Solution"
Sahabat Pasuruan,"Jl. Surabaya - Malang Km.50, Suwayuwo, Sukorejo Pasuruan Jawa Timur",0343-639625,"AXA Mandiri Financial Services, Corporate Solution, Individu Solution"
Saman,"Jl. Camar 11 No. 76, Gg. 4R No.9, Rw.7, Semper Barat, Kec. Cilincing - Jakarta Utara",021-22044228,"AXA Mandiri Financial Services, Corporate Solution, Individu Solution"
Samarinda Medika Citra,Jl. Kadrie Oening No.81 Rt.35 Samarinda 75124,0541-7273000,"AXA Mandiri Financial Services, Corporate Solution, Individu Solution"
Samaritan Palu,Jl. Towua No.77 Palu - Sulawesi Tengah,0451-4010925,"AXA Mandiri Financial Services, Corporate Solution, Individu Solution"
Sammarie Basra,"Jl. Basuki Rachmat No. 31, Pondok Bambu, Duren Sawit",021-86613145,"AXA Mandiri Financial Services, Corporate Solution, Individu Solution"
Santa Clara,"Jl. Biliton, No.15",0351-462688/452770/464571,"AXA Mandiri Financial Services, Corporate Solution, Individu Solution"
Santa Elisabeth Sei Lekop,"Jl. Sei Binti Kav.Sungai Lekop Rt.001/Rw.013, Sagulung, Batam, Kep. Riau",0778-3800268/380332,"AXA Mandiri Financial Services, Corporate Solution, Individu Solution"
Santa Maria Pekanbaru,Jl. A. Yani No.68 Pekanbaru Riau,0761-28800 / 20235,"AXA Mandiri Financial Services, Corporate Solution, Individu Solution"
Santa Maria Pemalang,Jl. Pemuda No.24,0284-321251/321426,"AXA Mandiri Financial Services, Corporate Solution, Individu Solution"
Santo Antonio,"Jl. Garuda No.3, Km.3, Ds. Tanjungbaru Kec. Baturaja Timur Sumatera Selatan",0735-320395/322418,"AXA Mandiri Financial Services, Corporate Solution, Individu Solution"
Santo Antonius Mataram,"Jl. Koperasi No.61 Ampenan - Mataram, NTB",0370-621397,"AXA Mandiri Financial Services, Corporate Solution, Individu Solution"
Santo Borromeus,Jl.Ir.H.Juanda No.100 Lebak Gede Coblong Bandung,022-2552083-95/2552003,"AXA Mandiri Financial Services, Corporate Solution, Individu Solution"
Santo Vincentius Singkawang,Jl. P. Diponegoro No.5,0562-631008,"AXA Mandiri Financial Services, Corporate Solution, Individu Solution"
Santo Yusup,Jl. Cikutra No.7 Bandung Jawa Barat,022-7208172,"AXA Mandiri Financial Services, Corporate Solution, Individu Solution"
Santosa Bandung International,Jl. Kebon Jati No. 38,022-4248333,"AXA Mandiri Financial Services, Corporate Solution, Individu Solution"
Santosa Hospital Bandung Kopo,Jl. KH Wahid Hasyim (Kopo) No.461-463 Bandung,022-5402241/54280333,"AXA Mandiri Financial Services, Corporate Solution, Individu Solution"
Sanur Medical Clinic,"Jl. By Pass Ngurah Rai No.234, Sanur, Denpasar Selatan Bali",0361-289116,"AXA Mandiri Financial Services, Corporate Solution, Individu Solution"
Sapta Mitra,"Jl. Pondok Kelapa Raya Blok A12 No 1
Malaka Jaya Duren Sawit Jakarta Timur",021-86906363,"AXA Mandiri Financial Services, Corporate Solution, Individu Solution"
Sapta Mitra Cikarang,"Ruko Cikarang Central City Blok H 29-30 Kel. Ciantra, Kec. Cikarang Selatan, Bekasi",021-22180039,"AXA Mandiri Financial Services, Corporate Solution, Individu Solution"
Sarah,Jl. Baja Raya No. 10 Petisah,061-4528044,"AXA Mandiri Financial Services, Corporate Solution, Individu Solution"
Saraswati,"Jl.Jend A Yani No.92 Dawuan, Cikampek Karawang",0264-311531/316101,"AXA Mandiri Financial Services, Corporate Solution, Individu Solution"
Sari Asih Ciledug,Jl. Hos Cokroaminoto No.38 Ciledug,021-7333430/7332758,"AXA Mandiri Financial Services, Corporate Solution, Individu Solution"
Sari Asih Ciputat,"Jl. Otista Raya No. 3 Sasak Tinggi Ciputat, Tangerang Selatan",021-7410808,"AXA Mandiri Financial Services, Corporate Solution, Individu Solution"
Sari Asih Karawaci,"Jl. Imam Bonjol, No.38",021-552 2794/5523239,"AXA Mandiri Financial Services, Corporate Solution, Individu Solution"
Sari Asih Sangiang,"Jl. Raya Mauk.Km.3,5 Simpang Tiga Sangiang",021-5582732,"AXA Mandiri Financial Services, Corporate Solution, Individu Solution"
Sari Asih Serang,"Jl. Jend.Sudirman, No.38, Penancangan, Cipocok",0254-220022,"AXA Mandiri Financial Services, Corporate Solution, Individu Solution"
Sari Medika,Jl. P. Antasari No. 5 Sampit,0531-25288 / 24396,"AXA Mandiri Financial Services, Corporate Solution, Individu Solution"
