Nama,Alamat,Telepon,Tags
Melawai Sko Grandmall,"Lt.2 No.18F , Padang",0751-448 8912,"AXA Mandiri Financial Services, Corporate Solution"
Melawai Slipi Jaya Plaza,"Kav.17-18, Pintu Utama",021-534 6364,"AXA Mandiri Financial Services, Corporate Solution"
Melawai Soekarno Hatta Ponorogo,"Jl. Soekarno no 194, kel. banyudono, kec. ponorogo, kab. ponorogo",0815 1981 1179,"AXA Mandiri Financial Services, Corporate Solution"
Melawai Sriwijaya Mataram,"Jl. Sriwijaya No. 78 C, Mataram, Kel. Sapta Marga, Kec. Cakranegara, Kota Mataram",0815 1960 4872,"AXA Mandiri Financial Services, Corporate Solution"
MELAWAI SUDIRMAN BINJAI,"Jl. Jenderal Sudirman No 4A A-B, Kel. Tangsi, Kec. Binjai Kota. Kota Binjai, Provinsi Sumatera Utara",0815 1987 6873,"AXA Mandiri Financial Services, Corporate Solution"
Melawai Sudirman Indramayu,"Ruko Indramayu Jln. Sudirman No. 57, Kelurahan Lemahabang, Kec. Indramayu, Kota. Indramayu, Prov. Jawa Barat",0815 8532 6760,"AXA Mandiri Financial Services, Corporate Solution"
Melawai Sudirman Madiun,"Jl. Panglima Sudirman No 29, Desa/Kel. Kejuron, Kec. Taman, Kota Madiun, Provinsi Jawa Timur",081519811190,"AXA Mandiri Financial Services, Corporate Solution"
Melawai Sudirman Pekanbaru,"Jl. Jendral Sudirman No. 150 Kel. Sukaramai Kec. Pekanbaru, Kota Pekanbaru, Riau",0815 1981 1184,"AXA Mandiri Financial Services, Corporate Solution"
Melawai Sudirman Sukabumi,"Jl. Sudirman No.63 Kel. Benteng, Kec. Warudoyong, Sukabumi, Jawa Barat",0815 1416 6731,"AXA Mandiri Financial Services, Corporate Solution"
Melawai Sukajadi Bandung,Jl. Sukajadi No.152 F,022-203 6306,"AXA Mandiri Financial Services, Corporate Solution"
Melawai Sumedang,"JL. Prabu Geusan Ulun No 133, RT 02 RW 13, Kel. Kotakulon, Kec. Sumedang Selatan, Kab. Sumedang, Provinsi Jawa Barat",0815-1994-4336,"AXA Mandiri Financial Services, Corporate Solution"
Melawai Summarecon Mall Bandung,"Unit Gf - 886 | Jl Grand Bulevar No.1, Summarecon Bandung, Kel Rancabolang, Kec. Gedebage Kota Bandung",0815 1416 6713,"AXA Mandiri Financial Services, Corporate Solution"
Melawai Summarecon Mall Bekasi,Summarecon Mall Bekasi Gf-156,021-2957 2367,"AXA Mandiri Financial Services, Corporate Solution"
Melawai Summarecon Serpong Ii,Unit Gf-210,021-2931 0520,"AXA Mandiri Financial Services, Corporate Solution"
Melawai Sun Plaza Medan,Gf Blok A No. 21 - 23,061-450 1043,"AXA Mandiri Financial Services, Corporate Solution"
Melawai Suncity Festival Mall,"Suncity Festival Mall Gf-B # 29-30, Jl. Setiabudi No.8, Oro-oro Ombo - Madiun",0351-447 2160,"AXA Mandiri Financial Services, Corporate Solution"
Melawai Sunda Bandung,Jl. Sunda No. 44 Bandung,022-420 1184,"AXA Mandiri Financial Services, Corporate Solution"
Melawai Sunrise Mall,"Gf – 12, Jl. Benteng Pancasila No.12 Mojokerto",0321-528 3185,"AXA Mandiri Financial Services, Corporate Solution"
Melawai Sunter Garden,Jl. Danau Sunter Utara Blok D1/7,021-650 2933,"AXA Mandiri Financial Services, Corporate Solution"
Melawai Sunter Mall,"Lt.1 Blok G. No.7, Jl. Danau Sunter Utara Barat No.7 Jakarta Utara",021-6583 4197,"AXA Mandiri Financial Services, Corporate Solution"
Melawai Super Mall Karawaci,Supermal Karawaci Lt. Ug No. 93 Tangerang,021-546 2411,"AXA Mandiri Financial Services, Corporate Solution"
Melawai Surya Sumantri,"JL. Surya Sumantri  No.59 RT. 05 RW. 04 KEL. Sukawarna  KEC. Sukajadi, Kota Bandung, Jawa Barat",0815-1996-5989,"AXA Mandiri Financial Services, Corporate Solution"
Melawai Tang City,Tang City Gf A.08 Tangerang,021-5973 1146,"AXA Mandiri Financial Services, Corporate Solution"
Melawai Tanjung Tabalong,"Jl. Ir. P.H.M Noor  Rt.007 , Kel. Belimbing Raya, Kec. Murung Pundak , Kab. Tabalong , Kalimantan Selatan",0815 1972 5265,"AXA Mandiri Financial Services, Corporate Solution"
Melawai Tebet,Jl. Tebet Raya No.09,021-831 8790,"AXA Mandiri Financial Services, Corporate Solution"
Melawai Tebet Supomo 30,Jl. Supomo No.30,021-8378 3299,"AXA Mandiri Financial Services, Corporate Solution"
Melawai Thamrin Plaza,"Lt. 2 No. 42-43, Jl. M.H Thamrin No.75, Kota Medan",061-736 2278,"AXA Mandiri Financial Services, Corporate Solution"
Melawai The Breeze Bsd City,"Unit L63B | Bsd Green Office Park, Jl. Bsd Grand Boulevard, Kel. Sampora, Kec. Cisauk, Kabupaten Tangerang, Banten 15345",0815 1942 0637,"AXA Mandiri Financial Services, Corporate Solution"
Melawai The Grand Outlet East Jakarta,"Unit 1035, Jl. Trans Heksa Kawasan Tnkp (Taman Niaga Karawang Prima) Kel.Wanasari, Kec. Telukjambe Bar, Karawang",0815 1416 6709,"AXA Mandiri Financial Services, Corporate Solution"
Melawai The Park Kendari,"Ground Floor – G0040. Jl. Brigjen M. Yoenoes, Desa/Kelurahan Bende, Kec. Kadia, Kota Kendari",0815-1423-4712,"AXA Mandiri Financial Services, Corporate Solution"
Melawai The Park Semarang,Lt 1 Unit 1-0390 - Jl. Madukoro Raya Blok F. Kel Tawangmas Kec. Semarang Barat,0815-1042-3913,"AXA Mandiri Financial Services, Corporate Solution"
Melawai The Park Solo,The Park Solo Lt.1 F#50,0271-789 1225,"AXA Mandiri Financial Services, Corporate Solution"
Melawai Thee Matic Majalaya,"Lt. Gf Unit G25, Jl. Anyar, Majasetra, Kec. Majalaya, Bandung, Jawa Barat 40382",022-8422 9697,"AXA Mandiri Financial Services, Corporate Solution"
Melawai Trans Studio Bali,Trans Studio Bali Lt.1 No.18,0361-620 7068,"AXA Mandiri Financial Services, Corporate Solution"
Melawai Trans Studio Cibubur,Trans Studio Cibubur (Km) Lt.1 No 55,021-3970 5598,"AXA Mandiri Financial Services, Corporate Solution"
Melawai Trans Studio Makasar,"Gf No.31 Jl. Metro Tj. Bunga Lt. GF - 31, Maccini Sombala, Tamalate - Kota Makassar",0411-360 4120,"AXA Mandiri Financial Services, Corporate Solution"
Melawai Trans Studio Mall Bandung,Trans Studio Mall Bandung Lt.Dasar B018 & B020,022-9109 1163,"AXA Mandiri Financial Services, Corporate Solution"
Melawai Transmart Bintaro,Transmart Bintaro Gf-15 Tangerang Banten,021-2221 9992,"AXA Mandiri Financial Services, Corporate Solution"
Melawai Transmart Bogor,Transmart Yasmin Gf - 16 Bogor,0251-759 5197,"AXA Mandiri Financial Services, Corporate Solution"
Melawai Transmart Cilandak,Transmart Cilandak Lt.1 No.9,021-7884 4504,"AXA Mandiri Financial Services, Corporate Solution"
Melawai Transmart Mx Mall Malang,"Transmart Mx Mall Malang Gf No 9, Jl.Veteran No.8 Penanggungan, Klojen - Malang",0341-502 6132,"AXA Mandiri Financial Services, Corporate Solution"
Melawai Transmart Padang,"Transmart Padang Gf.12,15, Jl. Khatib Sulaiman No.85 Lt. GF Unit 12 Padang",0751-897 1131,"AXA Mandiri Financial Services, Corporate Solution"
Melawai Transmart Pangkal Pinang,"Lt Gf 9A, Jl. Jendral Sudirman No. 51B, Taman Bunga, Gerunggang",0717-911 4097,"AXA Mandiri Financial Services, Corporate Solution"
Melawai Transmart Pekalongan,Optik Melawai Transmart Pekalongan Ground Floor Unit Gf 1 8,0285-432 973,"AXA Mandiri Financial Services, Corporate Solution"
Melawai Transmart Rungkut,Transmart Rungkut Gf 11-12,031-8785 5403,"AXA Mandiri Financial Services, Corporate Solution"
Melawai Transmart Srondol,"Transmart Srondol Gf-9, Jl. Setia Budi No.208, Semarang",024-7640 4022,"AXA Mandiri Financial Services, Corporate Solution"
Melawai Tuak Daun Merah Kupang,"JL. Bund PU, Kel. Tuak Daun Merah, KEC. Oebobo, Kota Kupang, Provinsi Nusa Tenggara Timur",0815 1989 6317,"AXA Mandiri Financial Services, Corporate Solution"
Melawai Tunjungan Plaza III,Lt.1 Unit 1.55 Surabaya,031-531 9210,"AXA Mandiri Financial Services, Corporate Solution"
Melawai Tunjungan Plaza IV,Tunjungan Plaza 4 Lt.3 No.53-56 Surabaya,031-534 2006,"AXA Mandiri Financial Services, Corporate Solution"
Melawai Tuparev Cirebon,"Jln. Tuparev No 103 Kel. Kertawinangun Kec. Kedawung Kab. Cirebon  ,Jawa Barat",0815 1960 4890,"AXA Mandiri Financial Services, Corporate Solution"
Melawai Ubertos,Ubertos Gf - 25,022-6373 2275,"AXA Mandiri Financial Services, Corporate Solution"
Melawai Udayana,Komplek Udayana No.21 B,0361-254 282,"AXA Mandiri Financial Services, Corporate Solution"
Melawai Uptown Mall Bsb Semarang,"Gf 05 - Jl Rm. Hadi Soebono Sosrowardoyo, Pesantren, Kec. Mijen",0815 8532 6759,"AXA Mandiri Financial Services, Corporate Solution"
Melawai Urip Sumoharjo Pekalongan,"JL Urip Sumoharjo, Kel. Kradenan, Kec. Pekalongan Selatan, Kota Pekalongan, Provinsi Jawa Tengah",0815-1989-6329,"AXA Mandiri Financial Services, Corporate Solution"
Melawai Wiryopranoto,"Jl. Sukarjo Wiryopranoto No.2-2A, Malang",0341-368 591,"AXA Mandiri Financial Services, Corporate Solution"
Melawai Yogya City Mall,Ug No.35 DI Yogyakarta,0274-6429231,"AXA Mandiri Financial Services, Corporate Solution"
Melinda,Jl. Pajajaran No. 46 Bandung,022-4222788/4209088/4266700,"AXA Mandiri Financial Services, Corporate Solution, Individu Solution"
Melinda II,"Jl. Cipto No 1 Rt 05/02, Kel. Pasirkaliki, Kec Cicendo, Kota Bandung.",022-4267888/4233777,"AXA Mandiri Financial Services, Corporate Solution, Individu Solution"
Mentari,Jl. Raya Legok Km.4 Kp. Bojong Nangka Kelapa Dua Tangerang,021-22228000,"AXA Mandiri Financial Services, Corporate Solution, Individu Solution"
Menteng Mitra Afiat,Jl. Kali Pasir No.9 Menteng Jakarta Pusat,021-3154050/3909484,"AXA Mandiri Financial Services, Corporate Solution, Individu Solution"
Merdeka Medical Center,Merdeka VIII/2 Tanjung Bungkak Denpasar,0361-233790,"AXA Mandiri Financial Services, Corporate Solution, Individu Solution"
Methodist,Jl. MH Thamrin No.105,061-7369000,"AXA Mandiri Financial Services, Corporate Solution, Individu Solution"
Metro Hospitals Cikarang (d/h Hosana Medica Cikarang Baru),"Jl. Anggrek I B2/2 Jababeka, Cikarang Baru, Bekasi",021-89831626/89832125,"AXA Mandiri Financial Services, Corporate Solution, Individu Solution"
Metro Hospitals Cikupa (d/h Mulia Insani),Jl. Raya Serang Km 16.8 Cikupa Tangerang,021-5962790/5962998/5962996,"AXA Mandiri Financial Services, Corporate Solution, Individu Solution"
Metro Hospitals Kebon Jeruk (d.h Bina Sehat Mandiri),"Jl. Duri Raya No.22 Kel. Duri Kepa, Kec. Kebon Jeruk, Jakarta Barat",021-5669411/ 5658870,"AXA Mandiri Financial Services, Corporate Solution, Individu Solution"
Metro Hospitals M Toha,Jl. M. Toha Km 2 No. 1 Nambo Jaya – Karawaci Tangerang Banten,021-5962790,"AXA Mandiri Financial Services, Corporate Solution, Individu Solution"
Metro Hospitals Sidoarjo (dh. RSIA Mitra Husada),"Jl.Raya Seruni No.159 Gedangan, Sidoarjo Jawa Timur",031-8917479,"AXA Mandiri Financial Services, Corporate Solution, Individu Solution"
Metro Medika Lombok,"Jl.Jendral Sudirman No.18A Rembiga Selaparang, Mataram – Ntb",0370-7847171,"AXA Mandiri Financial Services, Corporate Solution, Individu Solution"
Metropolitan Medical Centre ( Mmc ),"Jl. Hr. Rasuna Said, Kav. C21, Kuningan",021-5203435,"AXA Mandiri Financial Services, Individu Solution"
Metropolitan Medical Centre (MMC),"Jl. Hr. Rasuna Said, Kav. C21, Kuningan",021-5203435,"AXA Mandiri Financial Services, Corporate Solution, Individu Solution"
Metta Medika,"Jl. Sutoyo Siswoharjo No.34 Pasar Baru, Kota Sibolga, Sumatera Utara",0631-25007/25008,"AXA Mandiri Financial Services, Corporate Solution, Individu Solution"
Metta Medika Padangsidimpuan,Jl. Sisingamangaraja No.113 Padangsidimpuan,0634-4320777,"AXA Mandiri Financial Services, Corporate Solution, Individu Solution"
MGM 24 Kramat Jati,"Jl. Inpres No.19 Kampung Tengah Kramat Jati, Jakarta Timur",021- 80886446,"AXA Mandiri Financial Services, Corporate Solution, Individu Solution"
Mh Thamrin Pondok Gede,Jl. Raya Pondok Gede No 23-24 Kramat Jati,021-80887176/8093602,"AXA Mandiri Financial Services, Corporate Solution, Individu Solution"
Mh Thamrin Tegalan,Jl. Tegalan 30 Jakarta,021-8581344,"AXA Mandiri Financial Services, Corporate Solution, Individu Solution"
MH. Thamrin Cileungsi,Jl. Raya Narogong KM.16 Limus Nunggal Cileungsi Bogor,021-8265052 / 82491332,"AXA Mandiri Financial Services, Corporate Solution, Individu Solution"
Mhdc Menara Jamsostek,"Menara Utara Lt.1, Gd. Menara Jamsostek Jl. Jend.Gatot Subroto Kav.38 Kuningan Barat, Mampang Prapatan Jakarta Selatan",021-52961525,"AXA Mandiri Financial Services, Corporate Solution, Individu Solution"
Mhdc Menara Sentraya,"Menara Sentraya Gf Unit B1, Jl. Iskandarsyah Raya No. 1A, Rt.3/Rw.1 Jakarta Selatan",021-27881766,"AXA Mandiri Financial Services, Corporate Solution, Individu Solution"
Mhdc Wisma 46,"Wisma 46 Kota Bni Lt1.10, Jl. Jend Sudirman Kav 1 Rt/Rw: 10/09, Karet Tengsin, Tanah Abang Jakarta Pusat",021-5742211,"AXA Mandiri Financial Services, Corporate Solution, Individu Solution"
Miracle Asia Afrika,Jl. Asia Afrika No.122-124 RT06/01 Kel.Paledang Kec.Lengkong Bandung,022-4200706,"AXA Mandiri Financial Services, Corporate Solution, Individu Solution"
Miracle Gd. Indofood,Sudirman Plaza-Indofood Tower Lt.8 Jl. Jend Sudirman Kav. 76-78 Jakarta Pusat,021-57954537 / 38,"AXA Mandiri Financial Services, Corporate Solution, Individu Solution"
Miracle Grand Indonesia,Menara BCA Lt.9 Jl. MH Thamrin Jakarta Pusat,021-23587188 / 23587199,"AXA Mandiri Financial Services, Corporate Solution, Individu Solution"
Miracle Matraman,"Gd. BCA Matraman Lt. Basement, Jl. Matraman Raya Jakarta Timur",021-8581259/8581316,"AXA Mandiri Financial Services, Corporate Solution, Individu Solution"
Miracle Purwakarta,Komp. Aneka Jasa Blok A2 No.9-10 Kota Bukit Indah Purwakarta,0264-351366/351377,"AXA Mandiri Financial Services, Corporate Solution, Individu Solution"
Miracle Wisma Asia,"Gd. Wisma Asia Slipi Lt.7, Jl. Letjen S. Parman Kav.79 Slipi Jakarta Barat",021-5638888,"AXA Mandiri Financial Services, Corporate Solution, Individu Solution"
Misi Lebak,Jl. Multatuli No.41,0252-201014,"AXA Mandiri Financial Services, Corporate Solution, Individu Solution"
Mitra Bangsa,"Jl. Kol.Sugiyono, No.75",0295-382555,"AXA Mandiri Financial Services, Corporate Solution, Individu Solution"
Mitra Cakung,"Jl. Balai Rakyat No.38 Gempol, Cakung Jakarta Timur",021-29844221,"AXA Mandiri Financial Services, Corporate Solution, Individu Solution"
Mitra Family,"Jl. Raya Galuh Mas Raya, Sukaharja, Telukjambe Timur, Karawang, Jawa Barat 41361 (d/h JL. Ronggowaluyo RT.02/05 Desa Sukaharja Kec. Teluk Jambe Timur, Karawang)",0267-8458327/8458328/8458329,"AXA Mandiri Financial Services, Corporate Solution, Individu Solution"
Mitra Gempol (Klinik Gempol Group),Jl. Raya Proklamasi No. 89 Ds. Kalangsari Rengasdengklok,0267-483749,"AXA Mandiri Financial Services, Corporate Solution, Individu Solution"
Mitra Hermine,"Jl Komplek Ruko GMP Blok G No 13 A & 14 Tj Piayu, Sei Beduk< Kota Batam, Kep. Riau, 29433.",0778-7379180,"AXA Mandiri Financial Services, Corporate Solution, Individu Solution"
Mitra Husada,Jl. A. Yani No. 14 Pringsewu Lampung 35373,0729-23792,"AXA Mandiri Financial Services, Corporate Solution, Individu Solution"
Mitra Kasih,"Jl. Raya Cibabat No.341, Cimahi - Bandung",022-6654852/6652774/6654397,"AXA Mandiri Financial Services, Corporate Solution, Individu Solution"
Mitra Keluarga Bekasi Barat,"Jl. Jend. A.Yani, Bekasi Barat",021-8853333,"AXA Mandiri Financial Services, Corporate Solution, Individu Solution"
Mitra Keluarga Bekasi Timur,"Jl. Pengasinan Rawa Semut Margahayu, Bekasi Timur",021-8817777/89999222,"AXA Mandiri Financial Services, Corporate Solution, Individu Solution"
Mitra Keluarga Bintaro,"Jl. Bintaro Raya Utama Sektor 3A Tangerang Selatan, Banten 15225",021-27659777,"AXA Mandiri Financial Services, Corporate Solution, Individu Solution"
Mitra Keluarga Cibubur,"Jl. Alternatif Transyogi, Cibubur",021-84311771,"AXA Mandiri Financial Services, Corporate Solution, Individu Solution"
Mitra Keluarga Cikarang,"Jl. Industri Raya No. 100, Lemah Abang",021-89840500/89840900,"AXA Mandiri Financial Services, Corporate Solution, Individu Solution"
Mitra Keluarga Deltamas,"Jl.Deltamas Boulevard,Sukamahi, Cikarang Pusat Bekasi Jawa Barat",021-89978888,"AXA Mandiri Financial Services, Corporate Solution, Individu Solution"
Mitra Keluarga Depok,"JL. Margonda Raya, Pancoras Mas-Depok",021-77210700,"AXA Mandiri Financial Services, Corporate Solution, Individu Solution"
Mitra Keluarga Gading Serpong,"Jl. Raya Legok Karawaci No.20 Kel. Medang, Tangerang Banten",021-55689111,"AXA Mandiri Financial Services, Corporate Solution, Individu Solution"
Mitra Keluarga Grand Wisata,Jl Boulevard Grand Wisata Lambang Sari Kecamatan Tambun Selatan Kabupaten Bekasi Jawa Barat,021-80616909,"AXA Mandiri Financial Services, Corporate Solution, Individu Solution"
Mitra Keluarga Kalideres,"Jl. Peta Selatan No.1 RT.007/011 Kalideres, Jakarta Barat",021-22523700,"AXA Mandiri Financial Services, Corporate Solution, Individu Solution"
Mitra Keluarga Kelapa Gading,"Jl. Bukit Gading Raya Kav. 2 Kelapa Gading Permai, Jakarta Utara",021-45852700,"AXA Mandiri Financial Services, Corporate Solution, Individu Solution"
Mitra Keluarga Kenjeran,Jl. Kenjeran 506 Surabaya 60114,031-99000880,"AXA Mandiri Financial Services, Corporate Solution, Individu Solution"
Mitra Keluarga Pamulang,"Jl. Moch Toha RT.002 /017 Pamulang Timur, Tangerang Selatan",(021) 74792223,"AXA Mandiri Financial Services, Corporate Solution, Individu Solution"
Mitra Keluarga Pondok Tjandra,Jl. Raya Taman Asri Kav.Dd No.18 Waru Sidoarjo Jawa Timur,031-99691000,"AXA Mandiri Financial Services, Corporate Solution, Individu Solution"
Mitra Keluarga Pratama Jati Asih,Jl. Raya Jatimekar Rt.01/12 Jatimekar Kec. Jatiasih Bekasi Jawa Barat,021-85511000,"AXA Mandiri Financial Services, Corporate Solution, Individu Solution"
Mitra Keluarga Slawi,"JL. JENDERAL AHMAD YANI NO.25 RT 05/ RW 01 PROCOT, SLAWI, KAB TEGAL, JAWA TENGAH",(0283) 4565 777,"AXA Mandiri Financial Services, Corporate Solution, Individu Solution"
Mitra Keluarga Surabaya,"Jl. Satelit Indah Ii, Darmo Satelit",031-7345333,"AXA Mandiri Financial Services, Corporate Solution, Individu Solution"
Mitra Keluarga Tegal,"Jl. Sipelem, No.4, Kemandungan, Tegal Barat",0283-340399,"AXA Mandiri Financial Services, Corporate Solution, Individu Solution"
Mitra Keluarga Waru,"Jl. Raya Letjen. S.Parman, No.8",031-8543111/8542111,"AXA Mandiri Financial Services, Corporate Solution, Individu Solution"
Mitra Kemayoran,"JL. Landas Pacu Timur, Kemayoran",021-6545555/888,"AXA Mandiri Financial Services, Corporate Solution, Individu Solution"
Mitra Medicare Cimahi,Komp Taman Mutiara Blok B1 No.8 Rt01/016 Kel.Karangmekar,085230346205,"AXA Mandiri Financial Services, Corporate Solution, Individu Solution"
Mitra Medicare Driyorejo,Jl. Driyorejo Km.23 Kec Driyorejo,087854057209,"AXA Mandiri Financial Services, Corporate Solution, Individu Solution"
Mitra Medicare Gresik Manyar,"Jl. Raya Sukomulyo Km.24 Desa Sukomulyo, Manyar",087854057209,"AXA Mandiri Financial Services, Corporate Solution, Individu Solution"
Mitra Medicare Gresik Suci,"Jl. K.H Syafii No.100 Desa Suci, Manyar",087854057209,"AXA Mandiri Financial Services, Corporate Solution, Individu Solution"
Mitra Medicare Jatiuwung,"Komp. Ruko Sastra Blok A-20, Jl.Gatot Subroto Km.5 Kec.Jatiuwung",081333026864,"AXA Mandiri Financial Services, Corporate Solution, Individu Solution"
Mitra Medicare Pasar Kemis,Jl. Raya Otonom Pasar Kemis-Cikupa Ruko No.7 Rt 08/02Kec Sindang Jaya,081333026864,"AXA Mandiri Financial Services, Corporate Solution, Individu Solution"
Mitra Medicare Rancaekek Bandung,Jl. Raya Bandung Garut Kamp.Warung Cina No.318 Desa Linggar Rancaekek,08562271145,"AXA Mandiri Financial Services, Corporate Solution, Individu Solution"
Mitra Medicare Semarang,"Jl. Soekarno Hatta No.9 G Kel.Karangjati, Kec.Bergas, Ungaran",085230346304,"AXA Mandiri Financial Services, Corporate Solution, Individu Solution"
Mitra Medicare Surabaya,Jl. Dharmahusada Utara 36-38 Blok G-J Surabaya,081333026820,"AXA Mandiri Financial Services, Corporate Solution, Individu Solution"
Mitra Medika,"Jl. Desa Jatiwangi-Cikedokan/Sebelah Selatan Kawasan Mm 2100 Kp Kamurang Rt 1/1 Cikedokan, Cikarang Barat",021- 89983575/71691709/98213879,"AXA Mandiri Financial Services, Corporate Solution, Individu Solution"
Mitra Medika - Bandar Klippa,"Jl. Medan-Batang Kuis Dusun Xi Emplasmen Desa Bandar Klippa, Percut Sei Tuan Deli Serdang, Sumatera Utara",061-73381822,"AXA Mandiri Financial Services, Corporate Solution, Individu Solution"
Mitra Medika Abadi (D/h. Mitra Abadi),"Jl. Kapten Hanafiah No.3 RT.98 RW. 27 Kel. Karanganyar, Subang, Jawa Barat",0260-418247,"AXA Mandiri Financial Services, Corporate Solution, Individu Solution"
Mitra Medika Amplas,"Jl. Sisingamangaraja No.11 Kel.Harjosari 1, Kec.Medan Amplas Medan Sumatera Utara",061-7879080,"AXA Mandiri Financial Services, Corporate Solution, Individu Solution"
Mitra Medika Medan Tanjung Mulia,"JL. K. L. Yos Sudarso KM. 7,5 Tanjung Mulia Medan – Sumatera Utara",061-6640999,"AXA Mandiri Financial Services, Corporate Solution, Individu Solution"
Mitra Medika Pontianak,"Jl. Sultan Abdurrahman No. 25 Pontianak, Kalimantan Barat",0561-584888,"AXA Mandiri Financial Services, Corporate Solution, Individu Solution"
Mitra Medika Premiere,"JL. S Parman No.236 Petisah Tengah Kec. Medan Petisah, Sumatera Utara",061-4502021,"AXA Mandiri Financial Services, Corporate Solution, Individu Solution"
Mitra Medika Tipar,"Jl. Tipar Cakung No.37 Sukapura, Cilincing Jakarta Utara",021-4415892,"AXA Mandiri Financial Services, Corporate Solution, Individu Solution"
Mitra Plumbon,"Jl. Raya Plumbon, Km.11",0231-323100,"AXA Mandiri Financial Services, Corporate Solution, Individu Solution"
Mitra Sehat (Klinik Gempol Group),Jl. Kosambi Curug No. 28 Klari,0267-433930,"AXA Mandiri Financial Services, Corporate Solution, Individu Solution"
Mitra Sehat Medika,Jl. By Pass No.6 Pandaan,0343-636064,"AXA Mandiri Financial Services, Corporate Solution, Individu Solution"
Mitra Sejati Medan,JL. AH.Nasution Pangkalan Mahsyur No.7 Medan,061-7875967/ 7881682,"AXA Mandiri Financial Services, Corporate Solution, Individu Solution"
Mitrasana Bumyagara,"Taman Bumyagara A.04 Kel. Mustika Jaya, Bekasi",085100464921,"AXA Mandiri Financial Services, Corporate Solution, Individu Solution"
Mitrasana Green Pramuka City,"Apartemen Green Pramuka City, Tower Orchid Lt P1, Jl. A.Yani Kav.49, Rawasari, Cempaka Putih Jakarta Pusat",021-21475359,"AXA Mandiri Financial Services, Corporate Solution, Individu Solution"
Mitrasana Kaliabang,"Ruko Fitra Jaya, Jl.Kaliabang RT.01 RW.06 No.7 Kel.Perwira Kec.Bekasi Utara",021-88974206,"AXA Mandiri Financial Services, Corporate Solution, Individu Solution"
Mitrasana Kelapa Gading,"Jl. Boulevard Timur Raya Blok NB I No.36 Kel.Pegangsaan Dua,Kelapa Gading, Jakarta Utara",021-4513166,"AXA Mandiri Financial Services, Corporate Solution, Individu Solution"
Mitrasana Mega Regency 2,Perum Mega Regency Blok A09 Desa sukasari Kec. Serang Baru Kab. Bekasi 17330,082316989509,"AXA Mandiri Financial Services, Corporate Solution, Individu Solution"
Mitrasana Muchtar Tabrani,"Jl. KH. Muchtar Tabrani RT.03 RW.03 Kel.Perwira, Kec.Bekasi Utara, Kota Bekasi",085100629058,"AXA Mandiri Financial Services, Corporate Solution, Individu Solution"
Mitrasana Pondok Timur,"Pondok Timur Indah Blok G No.1 Pondok Timur, Kel.Jatimulya Kec.Tambun Selatan, Bekasi",085100822510,"AXA Mandiri Financial Services, Corporate Solution, Individu Solution"
Mitrasana Taman Aster,Ruko Taman Aster Kav.A.3 No.41 telaga Asih Cikarang Barat,021-88333364,"AXA Mandiri Financial Services, Corporate Solution, Individu Solution"
Mitrasana Taman Harapan Baru,"Jl.Taman Harapan Baru Blok E7 No.9 Pejuang, Medan Satria, Bekasi Barat",085100418827,"AXA Mandiri Financial Services, Corporate Solution, Individu Solution"
Mitrasana Wibawa Mukti,"Jl. Wibawa Mukti RT.001/11 Kp.Pedurenan, Jatiasih Bekasi",021-36487743,"AXA Mandiri Financial Services, Corporate Solution, Individu Solution"
Modern Medika Kragilan,Jl. Raya Serang Km15 Ruko D9 Kragilan,0254-281720,"AXA Mandiri Financial Services, Corporate Solution, Individu Solution"
MP Dental Center,"Hotel Intercontinental Lg Floor R27-28, Jl. Jend Sudirman Kav.10-11, Kel. Karet Tengsin, Kec. Tanah Abang Jakarta Pusat",021-5735336,"AXA Mandiri Financial Services, Corporate Solution, Individu Solution"
Mrccc-Siloam Hospitals Semanggi,"Jl. Garnisun 2-3 Karet, Semanggi Setiabudi (Belakang Univ. Atmajaya ) Jak- Sel",021-29962888,"AXA Mandiri Financial Services, Corporate Solution, Individu Solution"
Muhammadiyah Ahmad Dahlan Kediri,Jl. Gatot Subroto No 84 Kediri,0354-773115/776182/770182,"AXA Mandiri Financial Services, Corporate Solution, Individu Solution"
Muhammadiyah Bandung,Jl. Kh. Ahmad Dahlan No.53 Bandung,022-7301062/7312167/7323549,"AXA Mandiri Financial Services, Corporate Solution, Individu Solution"
Muhammadiyah Cepu,"Jl. Rongolawe, No.137",0296-421727,"AXA Mandiri Financial Services, Corporate Solution, Individu Solution"
Muhammadiyah Palangkaraya,"Jl. RTA. Milono Km.2,5 Palangkaraya",0536-3239444 / 3244801,"AXA Mandiri Financial Services, Corporate Solution"
Muhammadiyah Siti Aminah,"Jl. Diponegoro, Bumiayu",0289-432209/430683,"AXA Mandiri Financial Services, Corporate Solution, Individu Solution"
Muhammadiyah Siti Khodijah Kediri,"Jl. Dr. Soetomo 322 Sukorejo, Kec.Gurah, Kab. Kediri, Jawa Timur",0354-545481 / 546593,"AXA Mandiri Financial Services, Corporate Solution, Individu Solution"
Muhammadiyah Taman Puring,Jl. Gandaria I No.20 Kebayoran Baru,021-7229623/7250243/7208358,"AXA Mandiri Financial Services, Corporate Solution, Individu Solution"
Muhaya,"Jl. Jend Sudirman No. 18, Taman Bunga, Gerunggang, Pangkal Pinang Kep Bangka Belitung",0717-436997,"AXA Mandiri Financial Services, Corporate Solution, Individu Solution"
Mujaisyah,"Jl. Dr.Ratulangi.Km.5 Balandai, Bara, Temmalebba Palopo Sulawesi Selatan",0471-3311727,"AXA Mandiri Financial Services, Corporate Solution, Individu Solution"
Mulia Health dental care,"Gedung Menara Mulia, Suite LG,Jl. Jend Gatot Subroto Kav 9-11 Jakarta Selatan",021-5223838,"AXA Mandiri Financial Services, Corporate Solution, Individu Solution"
Mulia Health Dental Care Bulog II,"Gd.Bulog II,Jl.Kuningan Timur Blok M2/5 Jakarta Selatan",021-5210284,"AXA Mandiri Financial Services, Corporate Solution, Individu Solution"
